{
  "$schema": "https://yehyakin.github.io/kin-design-system/next/schemas/versions.schema.json",
  "schema_version": "2.0.0",
  "kind": "kin-agent-distribution-versions",
  "artifact_status": "generated-derivative",
  "generated": true,
  "normative": false,
  "editable": false,
  "latest_agent_distribution": null,
  "versions": [
    {
      "version": "3.0.1",
      "publication_state": "staged",
      "support_status": null,
      "repository_directory": "generated/agent/versions/v3.0.1",
      "manifest_url": null,
      "manifest_sha256": "94df2f455a69c8fd3983408f8ec0539eb4db1c3e1c97520dd2c46951eaf8e205",
      "kin_tag": "v3.0.1",
      "design_checksum": "1eb36408ce4b807eedbd8c91f07b81e92c96db027e10db30259e28e86cd30714",
      "input_set_checksum": "edacf69fb7222a6b51320fc1a73882b240524523a310d34da7ecefb119fb4061",
      "replacement": null,
      "advisory_url": null
    },
    {
      "version": "3.0.2",
      "publication_state": "staged",
      "support_status": null,
      "repository_directory": "generated/agent/versions/v3.0.2",
      "manifest_url": null,
      "manifest_sha256": "947f225b634bb11a8a243720f3e47672e051842b9987ed2f6f2eb26062626deb",
      "kin_tag": "v3.0.2",
      "design_checksum": "0a150644e93087d5aeee90ee0c6cc3084efaab40edb654ff0f5aaaf3d2016510",
      "input_set_checksum": "9e30554d18ee6454c546d37b65666cc64fc1f390a7c7545d027aea8db9cd6d7d",
      "replacement": null,
      "advisory_url": null
    }
  ]
}
